<?xml version="1.0" encoding="UTF-8"?>
<?xml-stylesheet href="transform.xsl" type="text/xsl"?>
<?xml-model href="travel5.xsd" type="application/xml" schematypens="http://www.w3.org/2001/XMLSchema"?>
<travel xmlns:ns="http://abc.com/trav" xsi:schemaLocation="www.abc.com/trav travel5.xsd" xmlns:xsi="http://www.w3.org/2001/XMLSchema-instance" >
  <loc>
    <destination id="1">
      <city>New York</city>
      <country>USA</country>
      <hotel>Vigaza</hotel>
      <hotel_rent>18000</hotel_rent>
    </destination>
    <flight id="f1">
      <airline>Delta</airline>
      <departure>2024-10-24</departure>
      <arrival>2024-10-25</arrival>
      <amount>5000</amount>
    </flight>
    <bus id="b1">
      <boarding>Pune</boarding>
      <departure>2025-01-10</departure>
      <arrival>2025-01-11</arrival>
      <amount>2000</amount>
      <dropping>Punjab</dropping>
  </bus>
  </loc>
<loc>
  <destination id="2">
    <city>Paris</city>
    <country>France</country>
    <hotel>Shuanza</hotel>
      <hotel_rent>16500</hotel_rent>
  </destination>
  <flight id="f2">
    <airline>Delta</airline>
    <departure>2024-12-25</departure>
    <arrival>2024-12-26</arrival>
    <amount>5000</amount>
  </flight>
    <bus id="b2">
        <boarding>Pune</boarding>
        <departure>2025-01-25</departure>
        <arrival>2025-01-28</arrival>
        <amount>1000</amount>
        <dropping>Shmla</dropping>
    </bus>
  </loc>
<hotels>
  <hotel id="h2">
    <name>Taj Hotel</name>
    <stars>5</stars>
    <price>1500</price>
  </hotel>
  </hotels>
<hotels>
  <hotel id="h1">
    <name>Grand Central Hotel</name>
    <stars>4</stars>
    <price>1000</price>
  </hotel>
</hotels>
<hotels>
    <hotel id="h3">
      <name>May Hotel</name>
      <stars>3</stars>
      <price>800</price>
    </hotel>
  </hotels>
  </travel>
  